{
  "lesson_id": "1-1",
  "title_ar": "حركة الكواكب والجاذبية",
  "title_en": "Planetary Motion and Gravitation",
  "source": {
    "book_title_ar": "الفيزياء 2 - نظام المسارات - السنة الثانية",
    "edition": "1447 / 2025",
    "page_offset": 0,
    "extraction": "vision-once",
    "fidelity": "paraphrased-faithful"
  },
  "page_range": { "start": 9, "end": 17 },
  "lesson_summary_ar": "يربط الدرس قوانين كبلر التجريبية لحركة الكواكب بقانون نيوتن للجذب الكوني، ثم يستخدمه لحساب قوى الجذب والسرعات المدارية.",
  "key_terms": [
    { "term_ar": "قوانين كبلر", "term_en": "Kepler's Laws" },
    { "term_ar": "قانون الجذب الكوني", "term_en": "Universal Gravitation" }
  ],
  "common_misconceptions_ar": [
    "اعتقاد أن الجاذبية تنعدم على متن المركبة المدارية.",
    "الخلط بين الكتلة والوزن."
  ],
  "pages": [
    {
      "page": 9,
      "blocks": [
        { "type": "heading", "level": 1, "text_ar": "حركة الكواكب والجاذبية", "text_en": "Planetary Motion and Gravitation" },
        { "type": "objectives", "items_ar": [
          "وصف حركة الكواكب باستخدام قوانين كبلر الثلاثة.",
          "تطبيق قانون نيوتن للجذب الكوني لحساب قوة التجاذب."
        ]},
        { "type": "paragraph", "text_ar": "درس الفلكيون حركة الكواكب قرونًا، حتى صاغ كبلر ثلاثة قوانين تصف هذه الحركة وصفًا كميًا دقيقًا اعتمادًا على أرصاد تايكو براهي." }
      ]
    },
    {
      "page": 11,
      "blocks": [
        { "type": "key_term", "term_ar": "قانون المساحات", "term_en": "Law of Equal Areas",
          "definition_ar": "يكنس الخط الواصل بين الكوكب والشمس مساحات متساوية في أزمنة متساوية." },
        { "type": "equation", "id": "eq-kepler3", "latex": "T^2 = \\frac{4\\pi^2}{G M}\\,a^3",
          "caption_ar": "قانون كبلر الثالث.",
          "symbols_ar": [
            { "symbol": "T", "meaning_ar": "الزمن الدوري" },
            { "symbol": "a", "meaning_ar": "نصف المحور الأكبر للمدار" }
          ]
        },
        { "type": "figure", "id": "fig-1-3", "label_ar": "شكل 1-3",
          "caption_ar": "مدار إهليلجي لكوكب حول الشمس.",
          "description_ar": "مدار بيضوي والشمس في البؤرة اليسرى. مساحتان مظللتان متساويتان قرب الحضيض وقرب الأوج تُكنسان في زمنين متساويين، لإبراز تغير السرعة المدارية على طول المدار.",
          "pedagogical_point_ar": "تُستخدم لتفسير تسارع الكوكب قرب الشمس." }
      ]
    },
    {
      "page": 13,
      "blocks": [
        { "type": "equation", "id": "eq-newton-grav", "latex": "F = G\\,\\frac{m_1 m_2}{r^2}",
          "caption_ar": "قانون نيوتن للجذب الكوني." },
        { "type": "worked_example", "id": "ex-1-1", "printed_number": "1",
          "prompt_ar": "احسب قوة التجاذب بين كتلتين 5 kg و 8 kg تفصلهما 0.5 m.",
          "solution_ar": "نعوّض في F = G m₁m₂/r² حيث G = 6.67×10⁻¹¹ N·m²/kg².",
          "answer": "≈ 1.07×10⁻⁸ N" }
      ]
    },
    {
      "page": 15,
      "blocks": [
        { "type": "question_set", "title_ar": "أسئلة المراجعة 1-1", "page": 15, "questions": [
          {
            "type": "question", "id": "q-1-1-p15-3", "printed_number": "3", "page": 15,
            "section_ar": "أسئلة المراجعة", "qkind": "numerical",
            "prompt_ar": "قمر اصطناعي يدور على ارتفاع 400 km فوق سطح الأرض. احسب سرعته المدارية.",
            "given_ar": ["نصف قطر الأرض R = 6.37×10⁶ m", "كتلة الأرض M = 5.97×10²⁴ kg"],
            "subparts": [
              { "label": "أ", "prompt_ar": "احسب نصف قطر المدار r." },
              { "label": "ب", "prompt_ar": "احسب السرعة المدارية v." }
            ],
            "figure_ref": null,
            "answer_ar": "v ≈ 7.67×10³ m/s",
            "solution_steps_ar": [
              "r = R + h = 6.37×10⁶ + 4.0×10⁵ = 6.77×10⁶ m",
              "v = √(GM/r) ⇒ v ≈ 7.67×10³ m/s"
            ],
            "concept_tags": ["السرعة المدارية", "قانون الجذب الكوني"],
            "difficulty": "medium"
          }
        ]}
      ]
    }
  ]
}
